[
  {
    "description": "auto-I",
    "mean": {
      "H_branch": 0.22606470680890217,
      "H_rank": 0.957827901010048,
      "H_sub": 0.2330899803587791
    },
    "ond_class": "I",
    "std": {
      "H_branch": 0.0003316129273766822,
      "H_rank": 5.6023555362912805e-05,
      "H_sub": 0.00018423254334660558
    }
  },
  {
    "description": "auto-II",
    "mean": {
      "H_branch": 0.22572608350416584,
      "H_rank": 0.958050661341056,
      "H_sub": 0.23279985221482424
    },
    "ond_class": "II",
    "std": {
      "H_branch": 0.00021420227302014082,
      "H_rank": 7.21957824220556e-05,
      "H_sub": 9.954424298267609e-05
    }
  },
  {
    "description": "auto-III",
    "mean": {
      "H_branch": 0.20546385221543606,
      "H_rank": 0.9630293275340724,
      "H_sub": 0.21716452156863164
    },
    "ond_class": "III",
    "std": {
      "H_branch": 0.029066093471988276,
      "H_rank": 0.006617215392594612,
      "H_sub": 0.022480217232531508
    }
  },
  {
    "description": "auto-IV",
    "mean": {
      "H_branch": 0.2259134729261435,
      "H_rank": 0.9580430386342694,
      "H_sub": 0.23297112815283713
    },
    "ond_class": "IV",
    "std": {
      "H_branch": 0.05,
      "H_rank": 0.05,
      "H_sub": 0.05
    }
  }
]